<?xml version="1.0" encoding="UTF-8"?>
<factura
    xmlns:xs="http://www.w3.org/2001/XMLSchema-instance"
    xs:noNamespaceSchemaLocation="factura.xsd">
    <encabezado id_factura="A123">
        <fecha dia="11" mes="3" aÃ±o="2025" />
        <info_cliente nombre_fiscal="Nombre1" NIF="12345678A" nombre_comercial="nombre comercial 1"/>
        <info_proveedor nombre_fiscal="Nombre2" NIF="12345679B" nombre_comercial="Nombre comercial 2"/>
    </encabezado>
    
    <linea id_linea="B123" articulo_ref="C12">
        <articulo id_articulo="C12">
            <descripcion>Descripcion del articulo</descripcion>
            <precio_sin_iva>100</precio_sin_iva>
            <precio_con_iva tipo_iva="4">104</precio_con_iva>
        </articulo>
        <num_unidades>10</num_unidades>
        <importe_total>1040</importe_total>
            
    </linea>
    <linea id_linea="B124" articulo_ref="A22">
        <articulo id_articulo="A22">
            <descripcion>Descripcion del articulo</descripcion>
            <precio_sin_iva>80</precio_sin_iva>
            <precio_con_iva tipo_iva="21">96.8</precio_con_iva>
        </articulo>
        <num_unidades>5</num_unidades>
        <importe_total>484</importe_total>
            
    </linea>
    <resumen_total>
        <subtotal>
            <con_iva_4>1040.00</con_iva_4>
            <con_iva_10>0.00</con_iva_10>
            <con_iva_21>484.00</con_iva_21>
        </subtotal>
        <total_sin_iva>1400.00</total_sin_iva>
        <total_con_iva>1524.00</total_con_iva>
    </resumen_total>
</factura>